{
  "id": "SCN-013",
  "title": "Verify Event Inheritance Recalculation",
  "objective": "Validates that assigning an Event to a Tick causes its traits to be inherited by assets in that Tick and all subsequent Ticks.",
  "type": "Manual",
  "trace_to": {
    "requirements": [
      "FR-013"
    ]
  },
  "steps": [
    {
      "step": "As a GM, set up a timeline with 3 Ticks. In Tick 1, create a Scene 'Castle' with no special traits. Verify it exists in all Ticks.",
      "expected_result": "Timeline is created, and the 'Castle' scene exists in Ticks 1, 2, and 3."
    },
    {
      "step": "Create a new Event called 'Dragon Attack' with a trait 'On Fire'.",
      "expected_result": "The event is created but not yet assigned."
    },
    {
      "step": "Assign the 'Dragon Attack' Event to begin at Tick 2.",
      "expected_result": "The event assignment is saved. A warning about historical edits may appear; confirm it."
    },
    {
      "step": "Inspect the 'Castle' Scene in Tick 1.",
      "expected_result": "The 'Castle' scene should not have the 'On Fire' trait."
    },
    {
      "step": "Inspect the 'Castle' Scene in Tick 2 and Tick 3.",
      "expected_result": "The 'Castle' scene should now have the 'On Fire' trait in both Tick 2 and Tick 3, as a result of the event starting in Tick 2."
    }
  ],
  "status": "Active"
}